question,option_0,option_1,option_2,option_3,answer,remark
"Lisa在电子商务平台担任产品负责人，她在技术写作方面才能出色，同时广泛了解其他相关领域(例如测试和用户体验设计)的技能。她非常支持她的团队，可以在需要协助避免困难时，在她的专业之外展开充分工作。Lisa热爱学习的好奇心源自以下哪一项?Lisa, who works as a product owner in an e commerce platform, possesses excellent technical skills in technical writing, and broad skills in other relevant areas, such as testing and user experience design. She is also very supportive of her team and can work adequately outside of her specialty when the need arises to help avoid bottlenecks. Lisa’s curiosity to learn is derived by which of the following?",对在职业生涯后期加入一个专业的职能团队的渴望 The desire to move to a specialized functional team later in her career,极具挑战的工作角色和工作环境 The highly challenging role and work environment,希望在自我组织的团队中工作的意愿 The willingness to work in a self-organizing team,长期的潜在回报与成为Scrum主管的机会 Long-term potential benefits and the opportunity to become a Scrum master,C,《敏捷实践指南》，4.3.3.通才型专家，P42。题干中描述了Lisa“在技术写作方面出色”，同时又“广泛了解其他相关领域的技能”，这是典型的“T型人才”，也是敏捷团队所需要的通才型专家。选项A错误，选项描述中存在两个错误，一是题干中没有描述Lisa处于职业生涯后期；二是通才型专家适用于敏捷团队，而不是职能团队。选项B错误。“极具挑战的工作角色和工作环境”描述过于笼统，同时题目中也没有描述该工作的角色和环境面临挑战的背景信息。选项C正确。敏捷环境强调的是“自组织团队”，因此热爱学习，成为通才型专家，源于在希望在自组织团队中工作。选项D错误。 通才型专家与长期的潜在回报，以及成为Scrum主管之间，没有必然的联系。
"项目经理了解到，两名团队成员晋升并将离开项目。为了向新团队成员说明项目角色, 项目经理应该准备或更新什么文件？The project manager learns that two team members are promoted and will leave the project. What documents should the project manager prepare or update in order to explain the project role to the new team members?",人员配备管理计划 Staffing Management Plan,组织图 Organization Chart,项目章程 Project Charter,责任分配矩阵 Responsibility Assignment Matrix,D,PMBOK(6)P316- 9.1.2.2数据表现-责任分配矩阵。责任分配矩阵显示了分配给每个工作包的项目资源，用于说明工作包或活动与项目团队成员之间的关系。新人来了，需要明确他的角色与职责。 其他选项：A是提前定义好的人员配备、遣散的计划，新人来了，应该先确认职责。B组织图和C项目章程可以后续提供。
"项目团队根据客户的性能规格进行设备验收测试，一旦测试完成，文件确认客户已验收设备。项目经理现在应该执行哪一个过程？A project team conducts acceptance testing of equipment against the performance specifications.Once testing is complete, documentation confirms client acceptance of the equipment. What process should the project manager now perform?",项目或阶段收尾 Close Project or phase,控制质量 Control Quality,控制采购 Control Procurement,监控项目工作 Monitor and Control Project Work,A,PMBOK（6）P128，4.7-结束项目或阶段。存档项目或阶段信息，完成计划的工作，释放组织团队资源以展开新的工作。“客户已经验收设备”，完成了确认范围，得到了验收报告，接下来要进行的项目收尾。选项B在情景之前。选项C，情景中没有提到采购事宜。选项D，监控项目工作贯穿项目始终，但是情景考察的是哪个过程与确认范围衔接，所以排除D选项。
团队成员对问题日志中大量未解决的技术问题感到不满。项目经理应该怎么做?Team members are unhappy about the significant number of unresolved technical problems in the issue log-What should the project manager do?,解释说这些问题应通过让主题专家(SMEs)参与解决 Explain that issues should be resolved by involving subject matter experts(SMEs).,请求更多时间来分析未完成的事项 Request more time to analyze the outstanding items.,将该情况上报给项目发起人，获得支持 Escalate the situation to the project sponsor to gain support.,提交变更请求，替换项目经理 Submit a change request to replace the project manager.,B,PMBOK(6)P132- 4.3.3.3 问题日志。问题解决需要更多的时间，需要帮团队成员争取更多时间，选择B。 其他选项：此题宜用排除法，A推给专家不对，团队成员是解决问题的所有方。C这个问题是项目经理要解决的，直接上报发起人不合适。D换项目经理不合理。
“开发人员刚刚完成了产品增量的构建，明天将在演示中向 Sara 展示。Sara 可能接受增量或要求对其进行更改。Sara 在该项目中最有可能扮演什么角色？”The developers have just finished building a product increment and will present it to Sara in a demonstration tomorrow. Sara may either accept the increment or request changes to it. What is Sara’s most likely role on the project?,产品负责人 Product owner,发起者 Sponsor,Scrum主管 Scrum Master,项目经理 Project manager,A,《敏捷实践指南》，5.2.5.展示/评审，P55。题干中的关键句是“将在演示中向Sara展示”，和“Sara可能接受增量或要求对其进行更改”。选项A正确。当团队以用户故事的形式完成特定功能时，团队会定期展示工作产品。看过展示后，产品负责人接受或拒绝故事。题干中描述Sara可能接受增量或要求对其进行修改，因此Sara最有可能扮演的角色就是产品负责人。
飞行安全相关方启动了一个项目，以制定解决方案，防止飞机降落在错误的跑道上。这些相关方正专注于一个针对大型航空公司的解决方案，尽管是私人飞行员(而非商业飞行员)要为90%以上的错误跑道事件负责。若要确保有效解决这个问题并提供预期的效益，项目经理可以怎么做？A project is initiated by Flight-safety stakeholders to develop a solution to prevent aircraft from landing on the wrong runway. These stakeholders are concentrating on a solution for large airline. Although private pilots rather than commercial pilots are responsible for over 90 percent of incorrect runway events. What can the project manager do to ensure that the problem is effectively addressed and the intended benefits are delivered?,记录这些相关方的假设，专注于大型航空公司将有效减少错误跑道事件 Document the stakeholders’ assumptions that concentrating on large airlines will effectively mitigate incorrect runway events,与相关方开会，讨论范围中同时涵盖商业和私人飞行员需求的重要性 Meet with stakeholders to discuss how critical it is for the scope to cover the needs of both commercial and private pilot,"平衡相关方的观点，首先专注于减轻航空公司层面错误跑道降落的问题，然后在以后关注私人飞行员的问题 Balance stakeholders perspective,concentrating first on mitigating high-profile incorrect runway landing by airline, and then focusing on private pilots at a later date",根据代表大型航空公司的相关方数量调整项目范围 Adjust the project scope based on the number of stakeholders who represent large airlines,B,PMBOK(6) 4.1.1.1 商业论证 90%都是私人飞机出错，结果相关方专注于大型航空公司，这个商业需求的论证明显不合理，需要与相关方沟通，明确大型航空和私人飞机要同时关注。 其他选项：要得到相关方对正确商业需求的认可，A只关注大型公司，C说一套做一套，D也只关注大型公司。
"作为Scrum主管，你在考虑自己的需求之前，先关注他人的需求，尤其是团队成员的需求。你为他们提供所需的支持，在适当的情况下让他们参与决策，并建立社群意识。你遵循的是哪种类型的领导方式？As a Scrum Master, you focus on the needs of others, especially team members, before you consider your own. You give them the support they need, involve them in decisions where appropriate, and build a sense of community. What type of leadership you are following?",民主型 Democratic,服务型 Servant,自由放任型 Laissez-faire,专制型 Autocratic,B,敏捷实践指南，P41Scrum主管是一种仆人式领导即服务型领导，作为服务型领导者，你首先是仆人，在考虑自己的需求之前，你会先关注团队的需求。你需要在确保消除障碍的同时提供所有必需的资源。
"项目经理从项目团队和供应商处收到一连串电子邮件,争论最近收到的一个可交付成果。项目团队认为该可交付成果未能满足特定需求,但供应商却坚持他们不知道这个需求。项目经理首先应该查阅哪份文件?A project manager receives a chain of e-mails from the project team and vendor,arguing about a recently received deliverable.The project team believes that the deliverable fails to meet a specific requirement,but the vendor maintains they are unaware of this requirement.To what should the project manager first refer?",需求管理计划 Requirements management plan.,工作分解结构(WBS) Work Breakdown structure(WBS).,沟通管理计划 Communication management plan.,工作说明书(SOW) Statement of works(SOW).,D,PMBOK(6)477 12.1.3.4 采购工作说明书 项目经理与供应商打交道应该基于外部文件而非内部文件，只有D是与供应商打交道的外部文件。里面确定了规格、数量、质量水平、绩效数据等等。 其他选项：ABC都是内部文件。
"你正在使用敏捷方法管理软件开发项目。你刚刚完成了一个版本，你应该为下一个版本做哪些准备?You are managing a software development project with an agile approach. You just completed the release one, what should you do to prepare for the next release?",确认范围基准是最新的 Confirm Scope baseline is up to date,检查待办事项列表 Review Backlogs,确认范围说明书仍然有效 Confirm Scope statement still valid,查看以前版本的WBS Review previous release WBS,B,《敏捷实践指南》第52页。敏捷项目中，待办事项列表是所有工作的有序列表，它以故事形式呈现给团队，团队根据自身能力，从待办事项列表中提取若干功能开始工作。完成一次迭代后，团队将下一张卡片从待办事项列表中拿出来讨论。题干中“刚刚完成了一个版本”，后续要先检查待办事项列表，以明确需求，确定下一步的工作，选项B正确。选项A“确认范围基线是最新的”和选项C“确认范围说明书仍然有效”都是预测型生命周期中的管理过程。选项D“查看以前版本的WBS”对于下一个版本的准备没有作用。
"项目经理正在敏捷项目的庞大工作量下苦苦挣扎。她在传统项目管理方面非常有经验，接手敏捷项目这是第一次。默认情况下，她正在应用传统项目管理的工具和技术。她太忙了，想看看是否可以分发一些任务出去。在尝试集中精力完成项目整合管理的同时，她可以委派哪些任务给她的团队？A project manager is struggling due to the high workload in an Agile project. She is quite experienced in traditional project management and this is her first Agile project. By default, she is applying the tools and techniques from traditional project management. She is swamped with work and is looking if she can delegate some tasks. What tasks may be delegated while attempting to focus on project integration management?",项目治理 Project governance,产品规划和交付 Product planning and delivery,项目风险管理 Project risk management,与项目集有关的管理 Managing linkages to the program,B,敏捷实践指南，P39敏捷鼓励自我管理团队，由团队成员决定谁执行下一阶段定义的范围内的工作。敏捷团队与仆人式领导一起茁壮成长，领导支持团队的工作方法。跨职能敏捷团队频繁创造功能性产品增量。这是因为团队集体对工作负责并共同拥有完成工作所需的必要技能。所以对于产品规划和交付的具体工作，可以委派给团队成员。选项A，项目治理由组织进行裁剪确定；选项C：项目风险管理也是产品规划和交付的一部分，B优于C。选项D：题干限定在敏捷项目中，没有提及项目集。
"一家保安公司正在免费为当地的避难所实施门禁控制。营销团队计划通过善意的宣传活动，确保整体覆盖-包括广播和电视广告，并让避难所及其发起人参与。这描述的是哪一项风险应对策略？A security firm is implementing access control at a local shelters at no charge. The marketing team plans a goodwill campaign ensuring press coverage, including radio and television features, and engagement with the shelter and its sponsors. Which risk response strategy does this describe?",风险分析 Risk exploiting,风险增强 Risk enhancement,风险接受 Risk acceptance,风险分摊 Risk sharing,D,PMBOK（6）P444-11.5.2.5机会应对策略-分享。分享涉及到将应对机会的责任分享给第三方，使其享有机会所带来的部分收益。题目中提示让避难所及其发起人参与，暗示将机会分享给第三方，D正确。其他选项：A风险分析不是风险应对策略。B风险增强/提高策略指的是提高积极风险（也叫机会）发生的概率和发生以后带来的影响。C风险接受指的是承认风险的存在，但是不主动采取措施，而是等发生后再采取应对措施，分为主动接受和被动接受。
"一个项目即将完成，高级管理层要求项目经理开始收尾过程，即使该项目还有许多待完成的可交付成果。项目经理应该使用什么来决定是否继续收尾？A project is nearing completion, senior management asks the project manager to begin the closing process, even though the project has a number of outstanding deliverables. What should the project manager use to decide whether to proceed with project closure?",阶段关卡 Phase gate,专家判断 Expert judgment,质量审计 Quality audit,偏差分析 Variance analysis,B,PMBOK(6)4.7 结束项目或阶段 题目问“用什么来决定”，可以理解是在问工具与技术，项目要收尾，通过专家判断来决定是否继续收尾 其他选项：A阶段关口与收尾决策无关，C不是收尾，D虽然是收尾工具，但是用来总结经验教训，而非做收尾决策的。
"项目经理加入一个项目，该项目正处于实施阶段，曾遭遇重大延期，预算超支和范围蔓延。项目经理希望在即将举行的变更控制委员会(CCB)会议上讨论一项变更，该变更将会让项目回到正轨。 项目经理在CCB会议上应说什么？The project manager adds a project that is in the implementation phase and has endured a major delay, budget overruns and scope spreading. The project manager hopes to discuss a change at the upcoming Change Control Board (CCB) meeting, which will get the project back on track. What should the project manager say at the CCB meeting?",变更成本及其对进度计划的影响 Changed cost and its impact on the schedule,变更成本和财务效益 Changed cost and financial benefits,对变更日志及进度计划的影响 Impact on the Change Log and Schedule,对变更日志的影响及变更的财务效益 Impact on the Change Log and financial benefits of such change,A,PMBOK（6）P113，4.6-实施整体变更控制。对变更进行评估时，要充分考虑变更请求的影响。选项A虽然没并没有提到对各个基准影响的评估，但是较其他选项全面，属于没有最优解下的次优解。选项B，由于之前曾经遇到过进度延期、预算超支和范围蔓延的失败教训，所以对变更请求的评估只局限于财务效益是不够的。选项CD，变更请求的评估结果纳入变更日志，而不是评估对变更日志的影响。
"在一个系统开发项目的执行阶段，一位关键开发人员由于个人原因，需要延长并进行计划外休假。项目经理知道，如果没有替代资源，项目进度计划就会面临风险。项目经理应该立即采取哪些措施来确保进度计划不会受到不利影响？During the execution phase of a system development project, a key developer takes extended and unplanned leave due to personal reasons. The Project manager knows that without a replacement resource, the project schedule is at risk. What should the project manager do immediate to ensure that the schedule is not adversely affected?",与所有开发人员开会，以确定重新分配开发任务的方案 Meet with all developers to determine options for reassigning development tasks,请求职能经理提供另一位技能熟练的开发人员 Ask the functional manager for another skilled developer,请求项目发起人提供有关处理资源问题的建议 Ask the project sponsor for suggestions for handing the resource issues,审查项目范围以减少开发任务，并相应的重新调整进度计划 Review the project scopes to reduce development tasks and realign the schedule accordingly,B,PMBOK（6）P328-9.3获取资源。因为集体劳资协议、分包商人员使用、矩阵型项目环境、内外部报告关系或其他原因，项目管理团队可能或可能不对资源选择有直接控制权。内部资源由职能经理或资源经理负责获取或分配。其他选项选项A：优先考虑获得替代资源，替代资源确实无法获得时再考虑A选项C：项目经理自身解决不了问题的时候再寻求发起人的帮助，题目中未能体现此时项目经理解决不了眼下的问题选项D：如果人员技能短板的问题无法解决，再对问题的影响评估，必要时提交变更请求，在选项B之后
你即将开始一个项目。你参与过许多传统项目，这将是你的第一个敏捷项目。你负责根据项目章程管理项目。你知道公司刚刚签署了项目章程，是由谁签署的?You are just about to start the project. You have worked on many traditional projects and this will be your first agile project. You are assigned to manage the project with the project charter. You know that the organization has just signed the Project Charter. Who signs the Project Charter?,产品负责人 The Product Owner,项目经理 The Project Manager,高级管理层 The Senior Management,Scrum主管 The Scrum Master,C,《敏捷实践指南》P41表4-2敏捷团队角色。项目章程是一种授权，它是由高级管理层签署，选项C正确。选项A：产品负责人负责指导产品的开发方向，对产品待办事项列表进行排序，实现产品价值的最大化。选项B：项目经理在敏捷项目中的角色有些是未知的，甚至许多敏捷开发下不涉及项目经理的角色，在敏捷环境中，项目经理充当仆人式领导，其工作重点转变为引导需要帮助的人，促进团队的合作，保持与相关方的需要一致。作为仆人式领导，项目经理要鼓励将责任分配给团队成员，分配给那些掌握完成任务所需知识的人。选项D：Scrum主管负责确保Scrum过程获得相应支持且Scrum团队遵从实践和规则，并指导团队消除障碍。
"项目经理正在领导一个项目,扩建一个小镇上的制造工厂。在上次市议会会议期间，当地居民对该项目表示担忧。项目经理将当地居民添加到相关方参与计划中,项目经理接下来应该做什么?A project manager is leading a project to expand a manufacturing plant in a small town.During the last city council meeting,local residents raised about the project.The project manager adds the local residents to the stakeholder engagement plan.What should the project manager do to address their concerns?","向当地的报纸提交一份文件,解释该扩建及其对社区的好处。 Submit an article to the local newspaper explaining the expansion and how it will benefit the community.",在市议会厅外安装一个滚动屏幕以提供项目进度更新。 Place a bulletin board outside the city hall to provide project progress updates.,在下次市议会会议期间召开互动问答会议 Hold an interactive question and answer session during the next city council meeting.,使用电视和广播点让他们了解项目及其担忧的问题 Use TV and radio spots to keep them informed about the project and their concerns.,D,PMBOK(6)P527- 13.2.2.2沟通技能。在开展管理相关方参与过程时，应该根据沟通管理计划，针对每个相关方采取相应的沟通方法。因为相关方人数过多，采取电视和广播是有效地沟通方式。其他选项：A报纸受众较低，B议会厅安排没几个人看得到，C受众也不大，而且等到下次市议会才进行时效性有限。
"在趋势分析过程中，项目经理得出结论，项目绩效已经恶化。这个结论是基于什么信息得出的？During the trend analysis,the project manager concluded that the project performance has deteriorate. On What information is this conclusion based?",挣值分析(EVA) Earned value analysis (EVA),完工估算(EAC) Estimate at Completion (EAC),质量成本(COQ) Cost of Quality (COQ),计划价值(PV) Planned value (PV),B,PMBOK(6)P264- 7.4.2.2趋势分析。 趋势分析，答案只有EAC是趋势分析，而趋势分析包括（EAC/ETC/TCPI等），偏差分析包括（SV/CV/SPI/CPI)，挣值分析包括（EV/PV/AC) 其他选项：A挣值分析包括计算（EV/PV/AC)
项目经理正在规划一个新的多公司参与项目，每家公司都有多名项目相关方。项目经理应该使用什么沟通方法？A project manager is planning a new multi-company project that has several stakeholders per company. What communication method should the project manager use?,交互式沟通 Interactive,推式沟通 Push,拉式沟通 Pull,选择性沟通 Selective,C,PMBOK（6）P374-10.1.2.5沟通方法。拉式沟通适用于大量复杂信息或大量信息受众的情况（多公司多名相关方）。它要求接收方在遵守有关安全规定的 前提之下自行访问相关内容。这种方法包括门户网站、企业内网、电子在线课程、经验教训数 据库或知识库。 选项A：交互式沟通适用于实时的、多向的信息交换，沟通成本较高。 选项B：推式沟通，这种方式可以确保信息的发送，但是不能确保信息送达目标和被目标受众理解。 选项D: 没有此沟通方法。
"在项目的最后一个星期,一场强风暴造成损害并影响项目的交付日期，项目经理应该怎么做？During the last week of the project,a strong storm causes damage and impacts the project's delivery date ?What should the project manager do?",提交变更请求 Submit a change request.,将其报告给项目发起人 Report it to the project sponsors.,使用储备分析技术 Use the reserve analysis technique.,更新风险登记册 Update the risk register.,A,PMBOK（6）P457-11.7.3.2监督风险-变更请求。执行监督风险过程后，可能会就成本基准和进度基准，或项目管理计划的其他组件提出变更请求，应该通过实施整体变更控制过程对变更请求进行审查和处理。 变更请求可能包括：建议的纠正与预防措施，以处理当前整体项目风险级别或单个项目风险。 选项B：是否报告发起人，要看风险应急计划中规划的应对策略。 选项C：储备分析技术用以判断风险敞口和储备之间的关系。 选项D：风险应急计划的执行结果更新到风险登记册，在选项A之后。
"一个用于交付IT解决方案实施项目的工作包正在准备中,项目经理检查验收标准,注意到可交付成果不符合验收标准清单中的两项。若要避免这个问题,在项目开发期间,项目经理应事先完成下列哪个?A work package for delivering IT solution implementation projects is in preparation, and the project manager checks the acceptance criteria, noting that deliverables do not meet two of the acceptance criteria list. To avoid this problem, which of the following should the project manager complete in advance during project development?",进行检查 Held inspections.,检查核查表 Examined the check-sheets.,进行测试 Conducted testing.,重新审查清单 Reviewed the checklist.,C,PMBOK(6)P303- 8.3.2.4测试/产品评估。可交付成果不符合标准，属于控制质量的过程，ABCD都是控制质量的工具。题干中说项目经理正在“检查”，因此，避免这个问题，A不合适，要往前找，书上说C测试是有早期预防的作用。而B只是统计数据，不针对具体的成果，排除。选项D是核对单，也是检查的工具，而且一般只有“对”“错”的勾选项目，而C测试是测试出具体的量化数据，可以提前预防，因此答案选C
