question,option_0,option_1,option_2,option_3,answer,remark
"项目经理与团队定期举行虚拟会议。在执行阶段,项目经理注意到两名特定团队成员经常争辩和发生分歧,这导致会议超时并让团队其他成员分心。项目经理应该做什么?A project manager runs regular virtual meetings with the team,During the execution phase,the project manager notices that two particular team members frequently argue and disagree,which causes meeting overruns and distractions for the rest of the team.What should the project manager do?","与团队成员讨论问题,如果继续存在该行为,则寻求管理层的决议 Discuss the issue with the team members,and seek resolution from management if the behavior continues.","告知这些团队成员他们的行为违反了团队章程,并将他们从团队中开除 Advise these team members that their behavior violates the team charter,and remove them from the team.",要求这些团队成员的职能经理解决这种行为 Ask these team members' functional managers to address this behavior.,"认识到这是震荡阶段的一部分,并安排团队建设活动 Recognize this as part of the storming stage,and arrange a team-building activity.",D,PMBOK(6)P338- 9.4 团队争吵，属于塔克曼阶梯理论的震荡阶段，团队建设是此过程重要的工具。 其他选项：AC都是找他人解决，不合适。B直接开除明显不正确。
"一项任务花费的时间比预期长，经审查，项目经理确定所分配的人员不具备必要的技能。若要将项目任务拉回正轨，项目经理应该怎么做？A task is taking longer than expected, upon review, the project manager identifies that the assigned resource does not process the necessary skills. What should the project manager do to get the task back on schedule?",制定并管理一份技能不熟练人员的纠正措施计划，以获得必要的技能 Establish and manage A corrective action plan for the unskilled resource to gain the necessary skills.,分配技能熟练的人员以帮助不熟练人员获得必要的技能 Assign a skilled resource to help the unskilled personnel acquire necessary skills,与职能经理会面，请求协助培训技能不熟练的人员 Meet with functional managers and request assistance in training unskilled personnel,与职能经理一起合作，以替换该人员 Work with the functional manager to replace this person,A,PMBOK（6）P342-9.4.2.6培训。项目经理应该按资源管理计划中的安排来实施预定的培训，也应该根据管理项目团队过程中的观察、交谈和项目，有效评估的结果，来开展必要的计划外培训。 选项B：如果有技能熟练的人员，就不存在短缺的问题。 选项C：在团队内部的培训由项目经理负责。 选项D：太绝对，因为职能部门也可能缺少合适的资源。
"在软件开发项目的冲刺会议上，项目经理正在为某个决定投票，一名团队成员握紧拳头。这是什么意思?During the sprint meeting for a software development project, the project manager was taking votes for a decision, and one team member held his fist closed. What does this mean?",他没有兴趣参与 He is not interested to participate,他对这个决定没意见 He is fine with the decision,他不同意这个决定 He disagrees with the decision,他完全支持这个决定 He fully supports the decision,C,举手表决是从投票方法衍生出来的一种形式，经常用于敏捷项目中。采用这种技术时，项目经理会让团队成员针对某个决定示意支持程度，举拳头表示不支持，伸五个手指表示完全支持，伸出三个以下手指的团队成员有机会与团队讨论其反对意见。项目经理会不断进行举手表决，直到整个团队达成共识（所有人都伸出三个以上手指）或同意进入下一个决定。题干中“团队成员握紧拳头”表示该成员不同意该决定，选项C正确，选项ABD不正确。
"从事一个全球项目的项目经理建立了多种沟通渠道。为了管理沟通渠道,项目经理应该怎么做?A Project manager working on a global project establishes various communication Channels. What should the project manager do to manage this?",安排在不同时区召开的会议 Arranged meetings in a different time zones,安排视频会议 Schedule video conferences.,创建沟通管理计划 Create a communication management plan,制定相关方参与计划 Develop a stakeholder management plan.,C,PMBOK(6)P377- 10.1.3.1 沟通管理计划。沟通的所有内容都要在《沟通管理计划中》体现。 其他选项：AB都在沟通管理计划中体现，D是沟通问题不是相关方问题。
"一家全球性公司的项目经理负责多个项目,其团队成员分布在全球各地。项目经理如何能够确保及时向每个团队成员提供信息?A project manager for a global company for a global company is responsible for several projects with team members located worldwide.How can the project manager ensure that information is delivered to every team member in a timely manner?",在公司的云文件夹中共享所有项目文件 Share all project documents in the company's cloud-based folders.,将相关方的需求记录在沟通管理计划中 Document stakeholders' requirements in the communications management plan.,安排一次所有项目成员均参加的虚拟开工会议 Schedule a virtual kick-off meeting with all project members.,向团队成员发送电子邮件通知和资料 Email notifications and materials to team member.,B,PMBOK(6)P377- 10.1.3.1 沟通管理计划。需要向团队成员提供各种项目信息，有可能ACD的方法都得用上，综合起来还是B，收集沟通需求，然后以沟通管理计划的形式发布最好
"在一个IT项目的第二个交付里程碑中执行了质量评估。由于提出了许多问题，项目经理希望了解质量趋势以及是否存在相关变量。项目经理应该使用哪一项工具？At the second delivery milestone of an IT project. A quality assessment is Performed ,A number of issues are raised, and the project manager wants to understand the trend about quality and whether or not there are related variables. What tool or technique should the project manager use?",石川图 Ishikawa diagram,散点图 Scatter diagram,帕累托图 Pareto chart,统计分析 Statistical sampling,B,PMBOK(6)P293- 8.2.2.4散点图。散点图是一种展示两个变量之间的关系的图形。题干中有明确说明，希望了解质量趋势以及是否存在相关变量，属于散点图。 其他选项：ACD都无法体现变更关系。
"在执行一个大型软件实施项目期间，服务器管理团队必须设置解决方案的基础架构。但是，该团队需要比预期更长的时间来完成工作，这延长了整个项目进度。因此，最初分配给项目的开发人员不可用。项目经理应该怎么做？During execution of a large software implementation project, the server administration team must set up the solution'sinfrastructure. However, this team takes much longer than expected to complete the work, which extended the entire project schedule。As a result, the developers originally assigned to the project are unavailable. What should the project manager do?",与相关方讨论资源制约因素，以确定更改资源管理计划的方案 Discuss the resource constraints with stakeholders to identify options for changing the resource management plans,在下一个状态报告中包含资源制约因素，并根据开发人员的可用性更新需求 Include the resource constraints in the next status report and update the requirements based on developers for availability,使用资源制约因素作为雇佣和培训其他开发人员的正当理由 Use the resource constraints as justification to hire and train additional developers,包含非工作日，以便可以在最初定义的时间表内交付项目 Include non-working days so that the project can be delivered within the originally defined timeline,A,PMBOK（6）230-6.6.3.5项目文件更新-资源日历。更新资源日历，以反映因资源优化、进度压缩，以及纠正或预防措施而导致的资源日历变更。项目进度延长所带来的资源不可用的这个制约因素应更新到资源日历中，并以此考虑是否需要更新资源管理计划。 选项BC：未经整体变更控制流程就擅自增加资源或者缩减范围都是不恰当的。 选项D：是否采取赶工，要依赖于评估的结果。
"在市政厅项目会议期间,市长提出翻新该城市中央公园的建议。一些商店业主请求提供每周项目进度报告。项目经理应更新哪一项内容?During a city hall project meeting,the mayor presents a proposal to refurbish the city`'s central park.Several store owners request weekly project progress reports. What should the project manager update?",相关方参与计划 Stakeholder engagement plan.,沟通管理计划 Communications management plan.,工作说明书(SOW) Statement of work(SOW).,项目调试计划 Project commissioning plan.,B,PMBOK（6）P377-10.1.3.1沟通管理计划，沟通管理计划中包括：需沟通的信息、上报步骤、项目信息流向图等。 题干聚焦在了“每周项目进度报告”，这是对信息的要求，所以是沟通管理计划，排除AC。D没有这个说法。
"在风险管理规划期间，项目团队决定外包一项关键服务，并与供应商签订了服务水平协议(SLA),项目团队使用的是哪一项风险应对策略？During the risk control planning process, the project team decides to outsource a key service and sign a service level agreement (SLA) with the supplier. Which risk response strategy does the project team use?",回避 Avoidance,减轻 Mitigation,接收 Acceptance,转移 Transfer,D,PMBOK(6)P442- 11.5.2.4威胁应对策略。外包属于转移风险。通过签订协议，把具体风险的归属和责任转移给第三方。
"敏捷团队正在根据商业分析师团队提供的用户故事开发产品。在第四次冲刺之后，相关方举行了一次演示，其中三个已完成的故事获得通过，其余两个故事未能满足相关方的期望，项目经理应该怎么做？An Agile teams is working on product according to the user stories provided by a team of business analysts. After the fourth sprint, a demo for stakeholders is held and Three completed stories pass, The remaining two stories fail to meet stakeholders expectations. What should the project manager do?",要求商业分析师开发新的用户故事 Ask the business analysts to develop new user stories,审查用户故事并签发变更请求 Review the user stories and issue a change request,"确认相关方的期望，然后更新并重新编写用户故事 Confirm stakeholder expectations, then update and rework the user stories",启动一个新项目，将修订后的用户故事纳入工作范围 Initiate a new project to incorporate revised user stories into the scope of work,C,在敏捷方法中，用户故事未通过，要重新梳理相关方的期望，并重新编写用户故事。 选项A：商业分析师负责收集需求 选项B：用户故事没有满足相关方的需求，需要重新开发。 选项D：没有进入到收尾阶段。
"在识别除项目经理之外的五名相关方之后，项目经理现在需要确定项目沟通的复杂性，潜在沟通渠道有多少？After identifying five stakeholders besides the project manager, the project manager now needs to determine the complexity of the project communication, how many potential communication channels are there?",20,15,10,55,B,PMBOK(6)P369-10.1.2.2 沟通需求分析，沟通渠道数。潜在沟通渠道数为n(n-1)/2，n代表相关方数量。此题6*5/2=15。注：项目经理也要算进去。
"相关方表示非常担心某一非集中办公团队对项目期望和指示的理解，因为有之前与该团队合作导致返工的经验，项目经理应该釆用什么样的沟通方法来解决这个问题？Stakeholders expressed concerns about a non-co-located team’s understanding of expectations and instructions ,as previous experience with this team have resulted in rework, what communication method should the project manager implement to address this?",推式沟通 Push communication,集中沟通 Mass,拉式沟通 pull,交互式沟通 Interactive,D,PMBOK（6）P374-10.1.2.5沟通方法。在两方或多方之间进行的实时多向信息交换，适合采用交互式沟通（互动沟通）。 选项A：能够确保信息发送，但是不能确保信息接受的结果。 选项C：适用于大信息量的传递。
"创建工作分解结构（WBS）时，项目经理必须分解一项名为“招标”的任务。项目经理使用什么来进一步细分任务？While creating a work breakdown structure (WBS), a project manager must decompose a task titled “solicit bids.”What can the project manager use to further subdivide the task?",石川图 Ishikawa diagram,关键链法(CCM) Critical chain method (CCM),专家判断 Expert judgment,类比估算 Analogous estimating,C,PMBOK（6）P156-5.4.2.1 专家判断。此题考察的是创建WBS的工具，只有C对。
"公司正在开发一些新产品，在测试阶段，客户发现该产品的一个严重缺陷。项目经理应该使用什么来确定合适的解决方案？A company is developing a new produce.During the testing stage,customers identify a serious defect with it. What should the project manager use to determine an appropriate solution?",因果图 Cause-and-effect diagram,六西格玛 Six Sigma,专家判断 Expert judgement,面向X的设计 Design for X,A,PMBOK(6)P293- 8.2.2.4因果图。因果图，又称“鱼骨图”、“why-why分析图”或“石川图”，将问题陈述的原因分解为离散的分支，有助于识别问题的主要原因或根本原因。发现了一个严重问题，要先分析原因，因此选择因果图。
"项目经理加入一个项目，但项目团队缺乏必要的技能来产生一个关键可交付成果。项目经理应该怎么做？The project manager joins a project, but the project team lacks the necessary skills to create a key deliverable. What should the project manager do?",将该可交付成果分配给一名拥有学习新技能能力的团队成员 To assign the deliverables to a team member who is capable of learning new skills,与项目发起人协商，聘请拥有必要技能的外部资源 To negotiate with the project sponsor to hire external resources with the necessary skills,终止执行项目，直到必要的资源出现 To terminate the project execution until the necessary resources appear,将培训作为项目管理计划中项目工作的组成部分 To include training as part of the project works in the project management plan,D,PMBOK(6)P342- 9.4.2.6培训。技能的问题，都可以通过培训来解决。培训的时间与成本也要纳入项目管理计划。 其他选项：看到技能优先培训，ABC的优先级没有D高。
"在项目测试期间，识别到多个缺陷。由于团队还在解决积压的缺陷，测试将会超支的风险现在已经增加。 项目经理应该怎么做？During project testing,numerous defects are identified.Since a backlog of defects is already being addressed by the team,the risk that testing will overrun has now increase What should the project manager do?",将该问题上报给项目发起人 Escalate the issue to the project sponsor.,采用冲突管理技术来审查和确定缺陷的优先级 Adopt conflict management techniques to review and prioritize defects.,提交变更请求来解决缺陷 Submit change requests to resolve the defects.,请求额外的资源来处理缺陷积压 Request additional resources to work on the defect backlog.,C,PMBOK（6）P306-8.3.3.4变更请求。通过变更的方式来对缺陷进行补救。 选项AD：在对缺陷补救的时候，对积压的风险进行跟踪评估，制定应急计划。至于是否上报还是求助额外额度资源要依据评估的结果。 选项B：冲突管理通常用于团队内部，缺陷积压的问题根据评估的结果制定应对策略。
一位产品负责人在一个房间里放置了五台笔记本电脑，并邀请了四位不同的终端用户来测试新系统的性能。项目组的开发人员也被邀请到房间观察用户，做笔记并回答基本问题。场景中描述了以下哪些敏捷技术和工具？A product owner has set up a room with five laptops and invited four different end-users to test the capabilities of a new system. The developers from the project team have been invited in the room to observe the users take notes and answer the basic questions. Which of the following agile techniques and tools has been described in the scenario?,可用性测试 Usability testing,自动化测试 Automated testing,脚本测试 Scripted tests,探索性测试 Testing exploratory testing,A,《敏捷实践指南》，5.2.7.帮助团队交付价值的执行实践，P56。题干中的关键句是“邀请了四位不同的终端用户来测试新系统的性能”。根据关键字，可以首先排除选项B和选项C，“自动化测试”和“脚本测试”是通过运行提前编写好的工具或者程序来对产品功能进行测试，并不依赖测试者的直接操作，因此排除。选项A正确。“可用性测试”是测试者对产品进行测试。此测试的主要目标是确定终端用户使用系统的难易程度，并发现可能导致系统重新设计的可用性问题或缺陷，与题干描述相符合。选项D错误。“探索性测试“更多的是一种思维，它没有很具体的测试方法、技术和工具，更依赖测试人员的主观性。而题干中描述了四位终端用户要用笔记本电脑来测试新系统的性能，已经有很具体的测试操作和测试方法，因此排除。
"上一次冲刺回顾之后，你与团队决定开始用迭代方法完成更改和流程改进。你应该使用以下哪种方法或工具?After your recent sprint retrospective, you’ve decided with the team to start implementing changes and process improvements in an iterative approach. Which of the following methodologies/tools should you use?","PDCA(计划、执行、检查、行动) PDCA (Plan, Do, Check, Act)",根本原因分析 Root Cause Analysis,全面生产维护(TPM) Total Productive Maintenance (TPM),价值流程图 Value Stream Mapping,A,PMBOK(6)第275页，PDCA是持续改进的基本方法，通过这个质量改进举措可以提高项目管理的质量以及最终产品、服务或成果的质量。选项B：根本原因分析关注识别问题的主要原因，它可用于识别出现偏差的原因以及项目经理为达成项目目标应重点关注的领域。选项C：TPM活动就是通过全员参与，并以团队工作的方式，创建并维持优良的设备管理系统，提高设备的开机率（利用率），增进安全性及高质量，从而全面提高生产系统的运作效率。选项D：价值流程图运用精益制造的工具和技术来帮助企业理解和精简生产流程。
"项目团队未能监督一项高风险,因此未能按时执行减轻措施,项目经理指示团队立即执行该措施,但另一位经理否决了这一指示,因为对项目没有造成负面影响。项目经理下一步应该做什么?A project team failed to monitor a high risk,so the mitigation action was not performed on time.The project manager instructs the team to perform the action immediately,but anther manger overrules that since there was no negative impact. What should the project manager do next?",提交变更请求 Submit a change request.,询问团队未能监督风险的原因 Ask the team why the risk was not monitored,与团队一起重新评估风险 Reassess the risk with the team.,遵循经理的指示 Follow the manger's instructions.,C,PMBOK(6)P457- 11.7.2.3 风险审查会。在风险审查中，还可以识别出新的单个项目风险（包括已商定应对措施所引发的次生风险），重新评估当前风险。此风险没有影响，需要重新评估此风险。 其他选项：先重新评估，再采取AD的措施。B后面再说。
一位新的高级经理被授予监督多个项目的职责。经理要求敏捷项目领导提交月度报告，总结项目目前状态和预测完成的日期。以下哪项是项目负责人回应经理要求的最佳方式？A new senior manager has been given the responsibility of overseeing several projects. The manager asks an agile leader to share the monthly report summarizing the project status and the forecasted finish date. Which of the following is the best way in which the project leader should respond to the request of the manager?,建议高级经理参加每日站会 Suggest the senior manager attend the daily standup meetings,与经理分享项目燃尽图 Share the project burndown chart with the manager,要求高级经理使用EVM监控项目进度 Ask the senior manager to use EVM to monitor the project progress,按照高级经理的要求提供项目状态的详细报告 Provide a detailed report of the project status as asked by the senior manager,B,《敏捷实践指南》第64页。燃尽图是剩余工作与时间盒内剩余时间关系的一种图形化表示形式。团队能通过燃尽图看到在迭代过程中完成的工作，使用燃尽图查看项目随时间的进展情况。相关方可以通过这个方式来了解项目的进展情况。题干中的关键字“敏捷项目领导”说明这是一个敏捷项目，敏捷项目通过燃尽图/燃起图来跟踪和监督团队进度和项目状态，选项B正确。每日站会主要是团队成员回顾前一天的进展、宣布当天的计划、强调曾遇到或预期出现的障碍，高级管理层不需要了解到那么详细，选项A不正确。EVM技术和项目状态详细报告都是传统项目中对项目的监控方法，排除选项CD。
"在职能团队交付产品后，项目经理使用统计抽样和检查来确定产品是否达到预期需求。 这个过程的输出是什么？After a functional team delivers the product, the project manager uses statistical sampling and inspection to determine if the product performs as expect. What is the output of this process?",项目范围说明书 Project scope statement,质量测量指标 Quality metrics,核实的可交付成果 Verified deliverables,质量审计报告 Quality audit report,C,PMBOK(6)P305-8.3.3.2控制质量的输出-核实的可交付成果。批量的产品的质量，是通过抽样来进行检验的，检验结束合格后，可交付成果就变成了核实的可交付成果。 其他选项：ABD都不是检验以后的输出，检验针对的是可交付成果的检验。
你刚加入一家软件公司，在编写任何代码之前，公司要求完成完整的需求了解和设计阶段。这样的交付过程符合以下哪一项?You have newly joined a software house that requires going through the complete requirements and design phases before any code is written. Such a delivery process is aligned with which of the following?,敏捷宣言。 Agile Manifesto.,预测型生命周期。 Predictive Life Cycle.,计划-执行-检查-行动。 Plan-Do-Check-Act.,大规模敏捷框架(SAFeR) Scaled Agile Framework (SAFe®),B,《敏捷实践指南》第20页。预测型生命周期是一种更传统的方法，团队在项目开始时创建详细的需求和计划，然后一次性执行，执行是一个连续的过程。题干“编写任何代码之前，公司要求完成完整的需求了解和设计阶段”，说明该项目采用预测型生命周期，选项B正确。选项A：敏捷宣言的价值观之一是“应对变更而不是遵循计划”，敏捷欢迎对需求提出变更，帮助客户获得竞争优势。选项C：PDCA是一个持续改进的基本方法，与题意不符。选项D：大规模敏捷框架专注于在项目组合、项目集和团队层详细设定实践、角色和活动，强调围绕专注于向客户提供持续价值的价值流来组织企业。选项BCD均不符合题干描述。
"项目已准备好收尾,但审计认为组织归档程序存在缺陷。由于发起人对归档不感兴趣,项目经理接下来应该做什么?A project is ready for closure,but adults determine that there are defects in organizational archiving procedures.Since the sponsor is uninterested in arching.What should the project manager do next?",与所有相关方开会 Meet with all stakeholders.,更新组织归档标准 Update organizational archiving standards.,项目收尾 Close the project.,聘请归档专家 Hire archiving experts.,B,PMBOK(6)4.7 结束项目或阶段。项目审计发现问题，就解决问题，更新归档相关的标准程序。 其他选项：A没有必要 ，C不能忽略审计的问题，D主要是程序问题，改进就好了。
