question,option_0,option_1,option_2,option_3,answer,remark
"在项目的规划阶段,所需的外部和内部资源会发生冲突,若要解决这个问题,项目经理应该做什么?During a projects planning phase,required external and internal resources are conflict.What should the project manager do to receive this?",根据经验教训建立结构 Develop a structure based on lessons learne,创建责任分配矩阵(RAM) Create a responsibility assignment matrix(RAM).,"生成执行、负责、咨询和知情(RACI)图 Generate a responsible.accountable,consult,and inform(RACI)chart.",查看传统的组织结构图 Review a traditional organizational chart.,C,PMBOK(6)P317- 9.1.2.2 责任分配矩阵-RACI矩阵。RACI（执行、负责、咨询和知情）矩阵是RAM的其中一种类型，在团队是由内部和外部人员组成的情况下，RACI 矩阵对明确划分角色和职责特别有用。因此选C。 其他选项：AD不对，B责任分配矩阵是正确的，但是RACI明显更加精准，因为它可以针对这种有外部和内部资源同时存在的情况，非常有效。
一位相关方不同意月度状态报告，并要求项目经理每周亲自告知他们项目的状态，项目经理首先应该怎么做？A stakeholder disagrees with the monthly status report and asks the project manager to personally inform them of the project's status on a weekly basis. What should the project manager do first?,修改状态报告的形式和频率，以满足该相关方的需求 Modify the form and frequency of the status reports to accommodate the stakeholder needs,寻求与该相关方达成协议以管理他们的期望 Seek agreement with the stakeholder to manage their expectations,审查相关方参与计划，以重新审视该相关方的需求 Review the stakeholder engagement plan to revisit the stakeholder needs,与该相关方会面以说明状态报告的详细信息 Meet with the stakeholder to explain the details of the status reports,C,PMBOK（6）P523-13.3管理相关方参与。与相关方进行沟通和协作从而满足其需求与期望、处理问题，并促进相关方合理参与的过程。题目中说相关方不满意，说明相关方的需求未得到满足。因此先审查相关方参与计划，看一下相关方的需求是什么，C正确选项ABD：需要先审查相关方参与计划，看一下相关方的需求是什么，再决定下一步做什么，因此先做C
"你的敏捷顾问建议你开始在卡片上编写用户故事,每个故事代表一个工作。每张卡片都是状态信号，指示何时可以提取新的工作，这种方法有助你看见工作流程。顾问建议使用的工具是什么?Your agile consultant is suggesting that you start using writing your user stories on cards, where each of them represents single pieces of work. Each card acts as a signal of status and indicates when new work can be pulled, which will help you visualize your workflow. What tool is the consultant suggesting?",Scrum板 Scrum board,看板 Kanban board,任务板 Task board,用户故事板 User-stories board,B,《敏捷实践指南》P103页。看板是带有卡片的物理看板面板，它能够推动和实现整个系统中工作流的可视化，让每个人都可以看到。题干中“卡片上编写用户故事”“指示何时可以提取新的工作”“有助你看见工作流程”明显是看板的特点，选项B正确。选项AC：Scrum版是一种用于管理产品代办事项列表和冲刺代办事项列表的信息发射源，它能够清楚地展现团队角色及职责，帮助团队更新任务进度，促进团队信息共享，及时发现任务过程中的异常现象，从而查漏补缺。任务板跟Scrum版是一样的，它们流动的都是任务。选项D：用户故事板可以理解为铺上所有用户故事的一块板子，它类似用户故事地图，不过用户故事地图画有发布分支线，单纯的用户故事板没有这条线。
"项目经理正在管理一个产品开发项目，有许多国家的消费者将使用该产品，而且开发团队将在不同的地理位置工作，在制定实施策略时，项目经理首先应该做什么？A project manager is leading a product development project,Consumers across multiple countries, will use the product and the development team will working in different geographic locations. When developing the implementation strategy，what should the project manager do first?",创建工作分解结构(WBS)以了解所需工作的具体细节 Create A work breakdown structure (WBS) to understand the specific details of the required work,制定甘特图以确定每个地点的资源和职责 Develop a Gantlet Charts to identify resources and responsibilities for each location,确定可能影响项目成功的关键假设条件，制约因素和其他因素 Identify key assumptions，constraints and other factors that may impact project success,审查组织结构，以便与来自不同地点的团队进行有效协作 Review the organizational structure to effectively work with teams from different locations,C,PMBOK（6）P78-4.2.1.3事业环境因素。不同的地理位置、不同的文化背景，都是不受项目经理主观意愿影响的因素。 选项A：与事业环境因素关系不大； 选项B：甘特图主要用于进度的把控，B本身说法错误。 选项D：组织结构只显示汇报关系。
"在开工会议期间,一些相关方对项目管理计划的不同方面提出异议,在解决所有异议后,项目团队收到对计划的支持,发起人和相关方承诺完全支持该项目。这属于下面哪一项的实例?During a kick-off meeting,some stakeholders raised objections about different aspects of the project management plan.After addressing all objections,the project team received support of the plan,and the sponsor andstakeholders fully committed to the project.Of what is this an example?",精力充沛的相关方 Energetic stakeholders.,有效的规划和沟通 Effective planning and communication.,高效的团队协作 Efficient team collaboration.,相关方关系的复杂性 Complexity of stakeholder relationships.,B,PMBOK(6)P86-4.2.2.4开工会议。开工会议是规划过程组完成，执行过程组开始之前召开的会议，旨在获得获得相关方和团队的承诺。开工会议的顺利进行有赖于规划过程组卓有成效的工作和有效的沟通，从而回应相关方的关心，满足相关方的需求和期望。
"一个新产品开发项目运行了将近六个月。最近，你接替了前项目经理。随后，你听到项目团队谈论先前批准的范围，以及即便有强大的变更控制流程，需求还是不断变化。你应该怎么做？A new product development project is running for almost six months. Recently, you replaced the former project manager and ever since, you were hearing the project team istalking about changes in the previously approved scope and the ever-changing requirements, despite the robust change-control process in place. What should you do? .",考虑改变开发方法 Consider changing the development approach,拒绝所有即将发生的变更 Reject all upcoming changes,重新审视变更管理流程 Revisit the change management process,告诉团队只要有资金就欢迎所有变更 Inform the team to welcome all changes as long as they are funded,A,《敏捷实践指南》第13页。有些项目的项目需求具有很大的不确定性，而这可能导致大量变更和项目复杂性的提高。题干中，拥有完备的变更流程，还是无法应对高度的需求变更，是在告诉我们，传统项目管理方法不起作用，要做敏捷转型了。“需求不断变化”的情况下，项目更适合采用敏捷方法，因此选项A“考虑改变开发方法”有助于解决目前的问题。选项B：“拒绝所有即将发生的变更”不合理。选项C：题干表明项目“有强大的变更控制流程”，说明问题不在于变更控制流程，“重新审视变更管理流程”并不能解决目前的问题。选项D：“告诉团队只要有资金就欢迎所有变更”，这种做法很可能会导致项目范围和其他项目元素遭到损害，影响最终可交付成果，该选项不正确。
项目发起人已经提供了项目目标，项目经理正在努力去合理确定项目章程中应包含哪些内容。项目经理应该关注什么方面？A project sponsor has provided project objectives; and the project manager is working to appropriately determine what should be included in the project charter. On what should the project manager focus?,高层级需求 High-level requirements,需求文件 Requirements documentation,需求跟踪矩阵 Requirements traceabbility matrix,项目范围说明书 Project scope statement,A,PMBOK（6）P81，4.1.3.1-项目章程。题干考察项目章程的定义，项目章程是由项目启动人或发起人发布的，正式批准项目成立，并授权项目经理使用组织资源开展项目活动的文件。它记录了关于项目和项目预期交付的产品、服务或成果的高层级信息，例如高层级需求、高层级项目描述、边界定义以及主要可交付成果等。
"在一个工厂的项目建议书谈判期间，客户通知项目经理需要进行一项变更来提高性能。项目经理该怎么做？During project proposal negotiations for an industrial plant, the customer informs the project manager that a change is required to improve performance. What should the project manager do?",让项目发起人增加额外资金 Ask the project sponsor for additional funding.,征求高级管理层的建议 Call senior management for advice.,更新工作分解结构（WBS） Update the work breakdown structure (WBS).,修订风险应对计划 Revise the risk response plan.,B,PMBOK（6）P75-4.1制定项目章程。“项目建议书谈判期间”，项目的启动阶段，基准尚未形成，此时收到的变更请求通过协商的方式来解决，排除C选项。 选项A：是否增加依据协商的结果。 选项D：还未进入到规划阶段。
"在为主承包商建设一个场地时，项目经理得知确定施工方法所使用的信息是过时的，项目经理首先应该怎么做？While establishing a site for the primary contractor , the project manager realizes that outdated information was used to determine the construction method What should the project manager do first?",更新问题日志 Update the issue log,将其添加到经验教训储存库中 Add this to the lessons learned repository,寻求专家的专业支持 Seek specialized support from experts,开展过程改进活动 Conduct process improvement activities,A,PMBOK(6)P132- 4.3.3.3 问题日志 题目问题是“首先”要做什么， 结合选项，A是需最先要做的， 发现问题，先记录。在整个项目生命周期中，项目经理通常会遇到问题，应该用问题日志记录并跟踪问题。 其他选项：BCD都在更新问题日志后面再做。
"在冲刺评审会议上，其中一位主要利益相关方提出了一项新需求，该需求非常关键，应首先加以考虑。在这种情况下，你作为产品负责人，接下来要做什么？During the sprint review meeting, one of the key stakeholders came up with a new requirement which is highly critical and should be taken up first. What would you do next as a product owner in this case?",将需求添加到下一个迭代的待办事项列表中 Add the requirement to next iteration backlog,将需求添加到产品待办事项列表中 Add the requirement to the product backlog,召开一个冲刺计划会议，并与团队讨论这个需求 Hold a sprint planning meeting and take up this requirement with the team,在评审会议上通知团队成员，下一步需要处理这个需求 Inform the team members in the review meeting that they need to work on this requirement next,B,冲刺评审会议主要有两个主要作用，一是评审本次迭代的潜在产品增量，二是与外部相关方进行交互。当外部相关方在冲刺评审会议中提出了新的需求，PO可以加入待办事项列表中，但是只能由PO来最终决定需求优先级。选项A错误，需求是不是下个迭代做，是不是马上做，需要PO根据产品待办事项列表中的所有需求，进行评估和决策，然后确定是否要加入到下一个迭代的待办事项中，而不是在这个冲刺评审会议中直接决定。选项B正确，外部相关方提出的任何需求，都是要先加入待办事项列表中。选项C错误，与团队讲解和讨论需求，应该在待办事项梳理会议中进行选项D错误，需求是否马上做，需要由PO进行决策，根据产品待办事项列表中的所有需求，进行评估和决策。而不是直接通知团队成员马上处理。
"在与新组建的团队启动项目后不久，项目经理发现团队成员对意见分歧极为直言不讳。若要在团队建设过程中鼓励进展，项目经理应该怎么做？Shortly after kicking off a project with a newly formed team, the project manager discovers that team members are extremely vocal about differences of opinion. To encourage progression through the team building process,What should the project manager do ?",要求团队成员专注于完成任务 Ask team members to focus on task completion,营造一个反馈和肯定的环境，巩固支持团队的习惯 Foster an environment of feedback and affirmation to solidify habit that support the team,强调团队成员之间达成共识以尽量减少冲突的重要性 Stress the importance of consensus among team members to minimize conflict,经常审查并评团队和项目绩效 Frequently review and evaluate team and project performance,B,PMBOK（6）P336-9.4建设团队。建设团队是提高工作能力，促进团队成员互动，改善团队整体氛围，以提高项目绩效的过程。 其他选项选项A：忽略团队之间出现的冲突不可取选项C：同选项A，忽略冲突不可取，良性的冲突有助于团队成员提高绩效，开拓思路选项D：团队绩效评估，是对团队建设效果的评价，在选项B之后。
Mia正准备参加冲刺回顾会议时被发起者拦住了。他问Mia会议的内容，有谁参加会议。Mia告诉他，参加冲刺回顾会议的人包括：Mia was entering the sprint retrospective meeting when she was stopped by the sponsor. He asked Mia what the meeting was about and who all are the participants. Mia told that following roles are the attendees at the sprint retrospective meeting:,"Scrum主管，团队 Scrum Master, Team","产品负责人，Scrum主管，团队，客户 Product Owner, Scrum Master, Team, Customer","产品负责人，PMO，团队 Product Owner, PMO, Team","产品负责人，Scrum主管，团队 Product Owner, Scrum Master, Team",D,关键词：冲刺回顾会议考点：冲刺回顾会的参与人员。在敏捷里面会有鸡和猪的角色，猪是敏捷团队成员，包括PO，SM，DevTeam；鸡是团队外的人，利益相关方，领导等等，也就是可能会对项目有直接影响的人。冲刺回顾会由Scrum团队的所有成员即猪的角色参加。A选项 少了PO；B选项 多了客户；C选项 多了PMO，少了Scrum Master
"一个IT项目的客户坚持使用来自某个地区供应商的许可软件,在项目开始之前,合同中定义了不同的供应商和原产国。项目经理应该做什么?The client for an IT project insists on using licensed software from a vendor from a certain region.A different vendor and country of origin were defined in the contract prior to the project's start. What should the project manager do?",与客户分享合同协议 Share the contract agreement with the client.,通知客户已经采购该软件 Inform the client that the software was already purchase,从采购团队获得该地区的软件供应商清单 Obtain a list of software vendors from that region from the procurement team.,"提出一项变更请求,以符合客户的偏好 Initiate a change request to comply with the client's preference.",A,PMBOK(6)P489-12.2.3.2 协议。 客户提出新要求，项目经理应该和客户先看合同，如果必要，让客户提出变更 其他选项：先A，必要时再D，然后再考虑CB
两个团队成员之间的沟通不畅正在影响项目的进展。项目经理首先应该做什么?Miscommunication between two team members is affecting a project'sprogress. What should the project manager do first?,培训存在无效沟通问题的团队成员 Train the team members who are ineffectively communicating,要求将所有沟通发布到团队协作板上 Require that all communications are posted to a team collaboration board,遵循沟通管理计划 Follow the communications management plan,"与团队开会,以评估当前的沟通方式 Meet with the team to assess current communication styles",D,PMBOK(6)P392- 10.3.2.5 会议。沟通存在问题，首先先评估当前的方式是否有问题以及影响，必要的时候发起变更。其他选项：已经出了问题，就不能再遵循沟通管理计划，也不能遵循原沟通计划进行培训，因此AC不对，B在D的后面。
"由于技术已在其他工厂运行，一个项目的用户验收测试被省略。但是，在实施后，该技术不能按预期起作用。项目经理应该怎么做？User acceptance tests on a project have been omitted since the technology is operational at other factories.However,after implementation,the technology is not working as expected. What should the project manager do?",查看缺陷报告以确定并解决问题 Review the defect report ti identify and solve issue,提交变更请求 Submit a change request,执行根本原因分析，以确定纠正措施 Conduct a root cause analysis to identify corrective actions,使用测试脚本来解决问题 Use test scripts to resolve the issue,C,PMBOK(6)P304- 8.3.2.5数据表现-因果图。发生了问题，先分析原因并确定措施。其他选项：A查看报告意义不大，B或D是可能的解决方案之一，但是要先做完C才能做B或D。
"你是一个适应型项目的项目经理，正试图了解实际进度，估计完成可发布产品所需的时间。为了实现这个目标，你会使用什么调度技术?You are the project manager of an adaptive project and trying to find the actual progress and to estimate the time needed to have a releasable product. To achieve this objective, what scheduling technique would you use?",有待办事项列表的迭代进度计划 Iterative scheduling with a backlog,按需进度计划 On-demand scheduling,敏捷发布计划 Agile release planning,看板系统 Kanban system,C,项目使用适应型生命周期，适应型生命周期也称敏捷型生命周期。在敏捷项目中进度通过敏捷发布规划来进行。敏捷发布计划是一种根据业务目标、依赖关系和障碍来确定需要开发多少以及需要多长时间才能完成一个可发布产品的技术。题干中“试图了解实际进度，估计完成可发布产品所需的时间”可通过敏捷发布计划来实现，选项C正确。选项A：一个项目会有不止一个迭代，所以它并不能估算完成可发布产品所需的时间，选项A不正确。选项B：按需进度计划方法不依赖于以前为产品开发或产品增量制定的进度计划，而是在资源可用时立即从未完项和工作序列中提取出来开展。选项D：看板系统关注工作流程的可视化，D不能实现题干的目的。
"在考虑Scrum主管时，我们需要决定谁最适合这个角色。以下哪个任务不应该由Scrum主管执行?When considering the Scrum Master role, we need to decide who is best suited for it. Which of the following tasks should not be performed by a scrum master?",开展进修培训，提醒新团队在估算产品待办事项时使用规划扑克的规则 Performing refresher training to remind a new team about the rules of Planning Poker when estimating product backlog items,更新冲刺并发布燃尽图或燃起图。 Updating sprint and release burndown or burnup chart.,与非Scrum团队成员进行讨论 Having discussions with non-Scrum-team members,与内部和外部利益相关方会面，对即将到来的冲刺进行优先排序 Meeting with both the internal and external stakeholders to rank the priorities for the upcoming sprint,D,《敏捷实践指南》表4-2敏捷团队角色。与内部和外部利益相关方会面，对即将到来的冲刺进行优先排序是产品负责人的职责。选项A：Scrum主管负责确保Scrum过程获得相应支持且Scrum团队遵从实践和规则，并指导团队消除障碍，选项A是Scrum主管的职责；选项B：Scrum主管给团队定义基本规则，确保团队理解干系人期望并以连贯的单元模式工作，正确实施Scrum；选项C：Scrum主管是服务型领导，帮助Scrum团队外的人员了解他们如何与Scrum团队交互是有益的，通过改变他们与Scrum团队的互动方式来最大化Scrum团队所创造的价值。
"项目团队在完成现有工作后，马上在团队内部分配新工作。这是因为缺乏适当的汇报制度，也没有对在制品和剩余的工作进行控制。在这种情况下，你建议团队怎么做?The project team is struggling to assign new work among them as soon as existing work is completed. This is because there is no proper reporting, nor is there control of work in progress and the work remaining. What do you suggest the team do in such a situation?",使用看板指示牌 Use a Kanban sign board,消除工作中的浪费，创造额外的工作能力 Remove waste from the work to create extra capacity for work,应用六西格码，解决缺陷 Remove defects by applying the Six Sigma process,使用敏捷开发方法 Use an Agile development approach,A,敏捷实践指南，P105看板面板（看板指示牌）利用了进入和退出策略以及限制在制品等制约因素，可提供一目了然的工作流、瓶颈、阻碍和整体状态信息。此外，面板可作为面向所有观众的信息发射源，提供团队工作状态的最新信息。选项A正确。选项B：题目没有提及浪费相关，排除；选项C:六西格玛是一种改善企业质量流程管理的技术，通过减少缺陷来提高质量，降低成本。不符合题意；选项D：范围太大，没有聚焦题干的问题，排除。
"一个软件开发项目的项目章程已获批准,项目经理召集会议准备项目管理计划,项目经理得知开发团队成员对他们的角色和职责感到困惑。 若要避免这个问题,项目经理应该事先做什么?Approval of the project charter for a software development project has been obtained and the project manager calls a meeting to prepare the project management plan.The project manager learns that the development team members are confused about their roles and responsibilities. What should the project manager have done to avoid this?",审查沟通管理计划 Reviewed the communication management plan.,制定项目资源管理计划 Developed the project resource management plan.,创建一份相关方登记册 Created a stakeholder register.,分享工作分解结构(WBS) Shared the work breakdown structure(WBS).,B,PMBOK(6)P318- 9.1.3.1资源管理计划。团队的角色与职责在资源管理计划里。 其他选项：A沟通管理计划是关于项目沟通的信息，C相关方登记册记录了相关方的基本信息，D的WBS为范围基准的一部分
项目经理意识到数据收集不足并且不符合质量管理计划，这种疏忽将严重影响项目的制约因素。项目经理下一步应该怎么做？A project manager realizes that data gathering is insufficient and does not conform to the quality management plan. This oversight will seriously affect the project's constraints. What should the project manager do next?,提交变更请求，以修订质量管理计划 Submit a change request to revise the quality management plan.,"遵行因果分析，并将结果报告给项目发起人 Conduct a cause-and-effect analysis, and report the results to the project sponsor.",确定不合格的根本原因 Determine the root cause of the nonconformance.,"通知项目发起人，并要求与相关方开会，以修订质量管理计划 Inform the project sponsor, and request a meeting with stakeholder to revise the quality management plan.",C,PMBOK(6)P292- 8.2.2.2根本原因分析。根本原因分析是确定引起偏差、缺陷或风险的根本原因的一种分析技术。与质量管理计划有偏差，要先分析偏差的根本原因。 其他选项：A，错的不是质量管理计划，B上报没有意义，D在C之后。
